{
    "contractVersion": "v1",
    "verticalId": "ace-wholesale",
    "asOfDate": "2026-01-07",
    "customerId": "CUST-123",
    "shipTo": {
        "country": "NL",
        "postalCode": "1011AB"
    },
    "currency": "EUR",
    "lines": [
        {
            "sku": "SKU-001",
            "qty": 10
        },
        {
            "sku": "SKU-ABC",
            "qty": 1
        }
    ]
}